{
  "opendb_id": "0334e4d4-a854-4811-a419-e991054c763f",
  "metadata": {
    "name": "Silverstone Sugo SG11 Micro-ATX Mini Tower",
    "manufacturer": "Silverstone",
    "part_numbers": [
      "SST-SG11B                                                    SG11B"
    ],
    "series": "Sugo",
    "variant": ""
  },
  "form_factor": "Micro ATX Mini Tower",
  "color": [
    "BLACK"
  ],
  "power_supply": "None",
  "side_panel": "None",
  "has_transparent_side_panel": false,
  "front_panel_usb": "USB 3.2 Gen 1 Type-A",
  "max_video_card_length": 369,
  "max_cpu_cooler_height": null,
  "internal_3_5_bays": 3,
  "internal_2_5_bays": 9,
  "expansion_slots": 4,
  "dimensions": "",
  "volume": null,
  "weight": null,
  "general_product_information": {}
}