{
  "opendb_id": "07893e20-cca2-4d17-b34d-4bf3b502d398",
  "metadata": {
    "name": "Cougar DarkBlader X5 ATX Mid Tower Black",
    "manufacturer": "Cougar",
    "part_numbers": [
      "Dark Blader X5 White"
    ],
    "series": "DarkBlader",
    "variant": ""
  },
  "form_factor": "ATX Mid Tower",
  "color": [
    "WHITE"
  ],
  "power_supply": "None",
  "side_panel": "Tempered Glass",
  "has_transparent_side_panel": true,
  "front_panel_usb": "USB 3.2 Gen 1 Type-A                                                    USB 2.0 Type-A",
  "max_video_card_length": 400,
  "max_cpu_cooler_height": null,
  "internal_3_5_bays": 2,
  "internal_2_5_bays": 2,
  "expansion_slots": 7,
  "dimensions": "468 x 220 x 486",
  "volume": 50.039,
  "weight": null,
  "general_product_information": {}
}