{
  "opendb_id": "f8feb3dc-0713-490b-b5c2-968eee223626",
  "metadata": {
    "name": "Silverstone FARA H1M MicroATX Mini Tower",
    "manufacturer": "Silverstone",
    "part_numbers": [
      "SST-FAH1MB"
    ],
    "series": "FARA",
    "variant": ""
  },
  "form_factor": "Micro ATX Mini Tower",
  "color": "Black",
  "power_supply": "None",
  "side_panel": "None",
  "has_transparent_side_panel": false,
  "front_panel_usb": "USB 3.2 Gen 1 Type-A                                                    USB 2.0 Type-A",
  "max_video_card_length": 320,
  "max_cpu_cooler_height": null,
  "internal_3_5_bays": 2,
  "internal_2_5_bays": 2,
  "expansion_slots": 4,
  "dimensions": "366 x 210 x 392",
  "volume": 30.129,
  "weight": null,
  "general_product_information": {
    "walmart_sku": 692562929
  }
}