{
  "opendb_id": "f07c97b0-59d0-4928-89ff-6ac9cdb04030",
  "metadata": {
    "name": "Corsair 5000D ATX Mid Tower",
    "manufacturer": "Corsair",
    "part_numbers": [
      "CC-9011208-WW"
    ],
    "series": "5000D",
    "variant": ""
  },
  "form_factor": "ATX Mid Tower",
  "color": "Black",
  "power_supply": "None",
  "side_panel": "Tempered Glass",
  "has_transparent_side_panel": true,
  "front_panel_usb": "USB 3.2 Gen 2 Type-C                                                    USB 3.2 Gen 1 Type-A",
  "max_video_card_length": 420,
  "max_cpu_cooler_height": null,
  "internal_3_5_bays": 2,
  "internal_2_5_bays": 4,
  "expansion_slots": 7,
  "dimensions": "520 x 245 x 520",
  "volume": 66.248,
  "weight": null,
  "general_product_information": {}
}