{
  "opendb_id": "dd358ff5-31f7-4727-95e0-48c7c04a780c",
  "metadata": {
    "name": "Corsair iCUE 220T RGB Airflow ATX Mid Tower",
    "manufacturer": "Corsair",
    "part_numbers": [
      "CC-9011173-WW"
    ],
    "series": "iCUE",
    "variant": ""
  },
  "form_factor": "ATX Mid Tower",
  "color": [
    "BLACK"
  ],
  "power_supply": "None",
  "side_panel": "Tempered Glass",
  "has_transparent_side_panel": true,
  "front_panel_usb": "USB 3.2 Gen 1 Type-A",
  "max_video_card_length": 300,
  "max_cpu_cooler_height": null,
  "internal_3_5_bays": 2,
  "internal_2_5_bays": 2,
  "expansion_slots": 7,
  "dimensions": "395 x 210 x 450",
  "volume": 37.328,
  "weight": null,
  "general_product_information": {
    "newegg_sku": "9SIA6ZPA6B8263",
    "bestbuy_sku": 6370550,
    "walmart_sku": 138839094
  }
}