{
  "opendb_id": "a1abba48-0e01-4214-8608-e50202fb15af",
  "metadata": {
    "name": "SAMA Sama-3D ATX Mid Tower",
    "manufacturer": "SAMA",
    "part_numbers": [
      "Sama-3D"
    ],
    "series": "Sama-3D",
    "variant": ""
  },
  "form_factor": "ATX Mid Tower",
  "color": "Black",
  "power_supply": "None",
  "side_panel": "Tempered Glass",
  "has_transparent_side_panel": true,
  "front_panel_usb": "USB 3.2 Gen 1 Type-A                                                    USB 2.0 Type-A",
  "max_video_card_length": 320,
  "max_cpu_cooler_height": null,
  "internal_3_5_bays": 2,
  "internal_2_5_bays": 3,
  "expansion_slots": 7,
  "dimensions": "",
  "volume": null,
  "weight": null,
  "general_product_information": {
    "newegg_sku": "9SIB41TJX17292",
    "walmart_sku": 2995303462
  }
}