{
  "opendb_id": "a596ddf1-04dc-4a54-b667-e61590705dfe",
  "form_factor": "ATX Mid Tower",
  "supported_motherboard_form_factors": ["ATX", "Micro ATX", "Mini-ITX"],
  "color": ["BLUE"],
  "lighting": ["ARGB"],
  "power_supply": "None",
  "power_supply_included": false,
  "supported_power_supply_form_factors": ["ATX"],
  "side_panel": "Tempered Glass",
  "has_transparent_side_panel": true,
  "front_panel_usb": "USB 3.2 (Gen 2) Type-C x  1                                                  USB 3.0",
  "front_usb_ports": ["USB 3.2 (Gen 2) Type-C x 1", "USB 3.0 x 2"],
  "max_video_card_length": 415,
  "max_cpu_cooler_height": 160,
  "max_psu_length": 200,
  "internal_3_5_bays": 1,
  "internal_2_5_bays": 2,
  "power_supply_shroud": false,
  "expansion_slots": 7,
  "riser_expansion_slots": 0,
  "supports_rear_connecting_motherboard": true,
  "dimensions": "460 x 230 x 495",
  "dimensions_mm": {
    "depth": 442,
    "width": 285,
    "height": 410
  },
  "volume": 51.65,
  "weight": 15.28,
  "metadata": {
    "name": "Thermaltake View 380 ARGB ATX Mid Tower Blue with Tempered Glass Side Panel",
    "manufacturer": "Thermaltake",
    "part_numbers": [],
    "series": "View 380",
    "variant": "",
    "releaseYear": 2024,
    "manufacturer_color": "Hydrangea Blue",
    "last_manually_spec_verified_at": "2025-08-31T17:49:26.616Z"
  },
  "general_product_information": {
    "manufacturer_url": "https://www.thermaltake.com/view-380-tg-argb-hydrangea-blue-mid-tower-chassis.html"
  },
  "identifiers": {
    "version": 1,
    "identifiers": [
      {
        "type": "ean",
        "value": "0841163095331",
        "region": "all"
      },
      {
        "type": "mpn",
        "value": "CA-1Z2-00MFWN-00",
        "region": "all"
      },
      {
        "type": "upc",
        "value": "841163095331",
        "region": "all"
      }
    ],
    "retailer_listings": [
      {
        "source": "amazon",
        "channel": "au",
        "source_product_id": "B0D7NCDRD6",
        "pricing_enabled": true,
        "verified": true
      },
      {
        "source": "amazon",
        "channel": "be",
        "source_product_id": "B0D7NCDRD6",
        "pricing_enabled": true,
        "verified": true
      },
      {
        "source": "amazon",
        "channel": "ca",
        "source_product_id": "B0D7NCDRD6",
        "pricing_enabled": true,
        "verified": true
      },
      {
        "source": "amazon",
        "channel": "de",
        "source_product_id": "B0D7NCDRD6",
        "pricing_enabled": true,
        "verified": true
      },
      {
        "source": "amazon",
        "channel": "es",
        "source_product_id": "B0D7NCDRD6",
        "pricing_enabled": true,
        "verified": true
      },
      {
        "source": "amazon",
        "channel": "fr",
        "source_product_id": "B0D7NCDRD6",
        "pricing_enabled": true,
        "verified": true
      },
      {
        "source": "amazon",
        "channel": "ie",
        "source_product_id": "B0D7NCDRD6",
        "pricing_enabled": true,
        "verified": true
      },
      {
        "source": "amazon",
        "channel": "it",
        "source_product_id": "B0D7NCDRD6",
        "pricing_enabled": true,
        "verified": true
      },
      {
        "source": "amazon",
        "channel": "jp",
        "source_product_id": "B0D7NCDRD6",
        "pricing_enabled": true,
        "verified": true
      },
      {
        "source": "amazon",
        "channel": "nl",
        "source_product_id": "B0D7NCDRD6",
        "pricing_enabled": true,
        "verified": true
      },
      {
        "source": "amazon",
        "channel": "pl",
        "source_product_id": "B0D7NCDRD6",
        "pricing_enabled": true,
        "verified": true
      },
      {
        "source": "amazon",
        "channel": "se",
        "source_product_id": "B0D7NCDRD6",
        "pricing_enabled": true,
        "verified": true
      },
      {
        "source": "amazon",
        "channel": "sg",
        "source_product_id": "B0D7NCDRD6",
        "pricing_enabled": true,
        "verified": true
      },
      {
        "source": "amazon",
        "channel": "uk",
        "source_product_id": "B0D7NCDRD6",
        "pricing_enabled": true,
        "verified": true
      },
      {
        "source": "amazon",
        "channel": "us",
        "source_product_id": "B0D7NCDRD6",
        "pricing_enabled": true,
        "verified": true
      },
      {
        "source": "bestbuy",
        "channel": "us",
        "source_product_id": "6603512",
        "pricing_enabled": true,
        "verified": false
      },
      {
        "source": "bhphoto",
        "channel": "us",
        "source_product_id": "THV380TABL",
        "pricing_enabled": true,
        "verified": false
      },
      {
        "source": "mwave",
        "channel": "au",
        "source_product_id": "AC76870",
        "pricing_enabled": true,
        "verified": false
      },
      {
        "source": "newegg",
        "channel": "ca",
        "source_product_id": "N82E16811133546",
        "pricing_enabled": true,
        "verified": false
      },
      {
        "source": "newegg",
        "channel": "us",
        "source_product_id": "N82E16811133546",
        "pricing_enabled": true,
        "verified": false
      }
    ]
  }
}
