{
  "opendb_id": "1ad18bea-e9aa-4137-b922-5f7e332f3385",
  "form_factor": "ATX Mid Tower",
  "supported_motherboard_form_factors": ["ATX", "Micro ATX", "Mini-ITX"],
  "color": ["BLACK"],
  "lighting": [],
  "power_supply": "None",
  "supported_power_supply_form_factors": [],
  "side_panel": "Tempered Glass",
  "has_transparent_side_panel": true,
  "front_panel_usb": "USB 3.2 Gen 1 Type-A                                                    USB 2.0 Type-A",
  "front_usb_ports": [],
  "max_video_card_length": 330,
  "max_cpu_cooler_height": null,
  "internal_3_5_bays": 2,
  "internal_2_5_bays": 2,
  "expansion_slots": 7,
  "dimensions": "370 x 216 x 470",
  "volume": 37.562,
  "weight": null,
  "metadata": {
    "name": "KOLINK Stronghold Barricade ATX Mid Tower Black with Tempered Glass Side Panel and USB 3.2 Gen 1 Type-A, USB 2.0 Type-A",
    "manufacturer": "KOLINK",
    "part_numbers": ["STRONGHOLD BARRICADE", "PGW-CH-KOL-095"],
    "series": "Stronghold",
    "variant": ""
  },
  "general_product_information": {},
  "identifiers": {
    "version": 1,
    "identifiers": [
      {
        "type": "mpn",
        "value": "PGW-CH-KOL-095",
        "region": "all"
      },
      {
        "type": "mpn",
        "value": "STRONGHOLD BARRICADE",
        "region": "all"
      }
    ],
    "retailer_listings": []
  }
}
