{
  "opendb_id": "e3e48f92-8f18-406c-9819-3ecd362fed67",
  "metadata": {
    "name": "DIYPC F2 MicroATX Mini Tower",
    "manufacturer": "DIYPC",
    "part_numbers": [
      "DIY-F2-P"
    ],
    "series": "F2",
    "variant": ""
  },
  "form_factor": "Micro ATX Mini Tower",
  "color": "Black / Purple",
  "power_supply": "None",
  "side_panel": "Acrylic",
  "has_transparent_side_panel": true,
  "front_panel_usb": "USB 3.2 Gen 1 Type-A                                                    USB 2.0 Type-A",
  "max_video_card_length": 315,
  "max_cpu_cooler_height": null,
  "internal_3_5_bays": 2,
  "internal_2_5_bays": 3,
  "expansion_slots": 4,
  "dimensions": "",
  "volume": null,
  "weight": null,
  "general_product_information": {}
}