{
  "opendb_id": "e54526bd-37f6-4ee7-a10b-91b08d326512",
  "metadata": {
    "name": "Cougar FV270 ATX Mid Tower",
    "manufacturer": "Cougar",
    "part_numbers": [
      "FV270                                                    3858M60.0001                                                    CGR-58M6B"
    ],
    "series": "FV270",
    "variant": ""
  },
  "form_factor": "ATX Mid Tower",
  "color": "Black",
  "power_supply": "None",
  "side_panel": "Tempered Glass",
  "has_transparent_side_panel": true,
  "front_panel_usb": "USB 3.2 Gen 2 Type-C                                                    USB 3.2 Gen 1 Type-A",
  "max_video_card_length": 420,
  "max_cpu_cooler_height": null,
  "internal_3_5_bays": 2,
  "internal_2_5_bays": 2,
  "expansion_slots": 7,
  "dimensions": "512 x 268 x 530",
  "volume": 72.724,
  "weight": null,
  "general_product_information": {}
}