{
  "opendb_id": "2113d1c5-ca56-4a7c-8b0b-695b2eec4740",
  "form_factor": "ATX Mid Tower",
  "supported_motherboard_form_factors": ["ATX", "Micro ATX", "Mini-ITX"],
  "color": ["BLACK"],
  "lighting": [],
  "power_supply": "None",
  "supported_power_supply_form_factors": [],
  "side_panel": "Tempered Glass",
  "has_transparent_side_panel": true,
  "front_panel_usb": "USB 3.2 Gen 1 Type-C                                                    USB 3.2 Gen 1 Type-A",
  "front_usb_ports": [],
  "max_video_card_length": 360,
  "max_cpu_cooler_height": null,
  "internal_3_5_bays": 1,
  "internal_2_5_bays": 3,
  "expansion_slots": 7,
  "dimensions": "420 x 273 x 399",
  "volume": 45.749,
  "weight": null,
  "metadata": {
    "name": "GameMax Infinity ATX Mid Tower Black Tempered Glass Side Panel",
    "manufacturer": "GAMEMAX",
    "part_numbers": ["Infinity BK"],
    "series": "Infinity",
    "variant": ""
  },
  "general_product_information": {},
  "identifiers": {
    "version": 1,
    "identifiers": [
      {
        "type": "mpn",
        "value": "Infinity BK",
        "region": "all"
      }
    ],
    "retailer_listings": [
      {
        "source": "newegg",
        "channel": "ca",
        "source_product_id": "N82E16811445041",
        "pricing_enabled": true,
        "verified": false
      },
      {
        "source": "newegg",
        "channel": "us",
        "source_product_id": "N82E16811445041",
        "pricing_enabled": true,
        "verified": false
      }
    ]
  }
}
