{
  "opendb_id": "abaf965e-d799-4daa-acab-3e9db9e1f25e",
  "metadata": {
    "name": "KOLINK INSPIRE K2 RGB Micro-ATX Mini Tower",
    "manufacturer": "KOLINK",
    "part_numbers": [
      "INSPIRE K2 RGB"
    ],
    "series": "INSPIRE",
    "variant": ""
  },
  "form_factor": "Micro ATX Mini Tower",
  "color": [
    "BLACK"
  ],
  "power_supply": "None",
  "side_panel": "Tempered Glass",
  "has_transparent_side_panel": true,
  "front_panel_usb": "USB 3.2 Gen 1 Type-A                                                    USB 2.0 Type-A",
  "max_video_card_length": 320,
  "max_cpu_cooler_height": null,
  "internal_3_5_bays": 2,
  "internal_2_5_bays": 1,
  "expansion_slots": 4,
  "dimensions": "393 x 188 x 382",
  "volume": 28.224,
  "weight": null,
  "general_product_information": {}
}