{
  "opendb_id": "782b7b02-c4e5-427a-8a54-e6f21255029c",
  "form_factor": "ATX Mid Tower",
  "supported_motherboard_form_factors": ["ATX", "Micro ATX", "Mini-ITX"],
  "color": [],
  "lighting": [],
  "power_supply": "None",
  "supported_power_supply_form_factors": [],
  "side_panel": "Tempered Glass",
  "has_transparent_side_panel": true,
  "front_panel_usb": "USB 3.2 Gen 1 Type-A                                            USB 2.0 Type-A",
  "front_usb_ports": [],
  "max_video_card_length": 295,
  "max_cpu_cooler_height": null,
  "internal_3_5_bays": 2,
  "internal_2_5_bays": 0,
  "expansion_slots": 7,
  "dimensions": "345 x 207 x 451",
  "volume": 32.208,
  "weight": null,
  "metadata": {
    "name": "Antec AX26 RGB ELITE ATX Mid Tower Tempered Glass Side Panel",
    "manufacturer": "Antec",
    "part_numbers": ["AX26 RGB ELITE", "0-761345-10205-6"],
    "series": "AX26",
    "variant": ""
  },
  "general_product_information": {},
  "identifiers": {
    "version": 1,
    "identifiers": [
      {
        "type": "mpn",
        "value": "0-761345-10205-6",
        "region": "all"
      },
      {
        "type": "mpn",
        "value": "AX26 RGB ELITE",
        "region": "all"
      }
    ],
    "retailer_listings": []
  }
}
