{
  "opendb_id": "b3bfd756-dee7-4852-aa08-0929e880c955",
  "metadata": {
    "name": "MagniumGear NEO QUBE 2 Infinity Mirror ATX Mid Tower",
    "manufacturer": "MagniumGear",
    "part_numbers": [
      "MG-NE620QI_DBK02"
    ],
    "series": "NEO",
    "variant": ""
  },
  "form_factor": "ATX Mid Tower",
  "color": [
    "BLACK"
  ],
  "power_supply": "None",
  "side_panel": "Tempered Glass",
  "has_transparent_side_panel": true,
  "front_panel_usb": "USB 3.2 Gen 2 Type-C                                                    USB 3.2 Gen 1 Type-A",
  "max_video_card_length": 410,
  "max_cpu_cooler_height": null,
  "internal_3_5_bays": 2,
  "internal_2_5_bays": 5,
  "expansion_slots": 8,
  "dimensions": "460 x 270 x 450",
  "volume": 55.89,
  "weight": null,
  "general_product_information": {}
}