{
  "opendb_id": "c2644405-f2bd-4732-b2df-2a79f4ee7731",
  "form_factor": "Micro ATX Mini Tower",
  "supported_motherboard_form_factors": ["Micro ATX", "Mini-ITX"],
  "color": ["BLACK"],
  "lighting": [],
  "power_supply": "None",
  "supported_power_supply_form_factors": [],
  "side_panel": "Tempered Glass",
  "has_transparent_side_panel": true,
  "front_panel_usb": "USB 3.2 Gen 1 Type-A                                                    USB 2.0 Type-A",
  "front_usb_ports": [],
  "max_video_card_length": 300,
  "max_cpu_cooler_height": null,
  "internal_3_5_bays": 2,
  "internal_2_5_bays": 2,
  "expansion_slots": 5,
  "dimensions": "384 x 200 x 451",
  "volume": 34.637,
  "weight": null,
  "metadata": {
    "name": "Antec NX500M ARGB Micro ATX Mini Tower Black with Tempered Glass Side Panel and USB 3.2 Gen 1 Type-A, USB 2.0 Type-A",
    "manufacturer": "Antec",
    "part_numbers": ["NX500M ARGB", "0-761345-81057-9"],
    "series": "NX500M",
    "variant": ""
  },
  "general_product_information": {},
  "identifiers": {
    "version": 1,
    "identifiers": [
      {
        "type": "mpn",
        "value": "0-761345-81057-9",
        "region": "all"
      },
      {
        "type": "mpn",
        "value": "NX500M ARGB",
        "region": "all"
      }
    ],
    "retailer_listings": []
  }
}
