{
  "opendb_id": "6e0a0261-8e71-49c0-9e73-f8e2c27d9a87",
  "form_factor": "ATX Full Tower",
  "supported_motherboard_form_factors": ["ATX", "Micro ATX", "Mini-ITX"],
  "color": ["BLACK"],
  "lighting": [],
  "power_supply": "None",
  "supported_power_supply_form_factors": [],
  "side_panel": "Acrylic",
  "has_transparent_side_panel": true,
  "front_panel_usb": "USB 3.2 Gen 1 Type-A                                                    USB 2.0 Type-A",
  "front_usb_ports": [],
  "max_video_card_length": 450,
  "max_cpu_cooler_height": null,
  "internal_3_5_bays": 6,
  "internal_2_5_bays": 4,
  "expansion_slots": 9,
  "dimensions": "563 x 246 x 568",
  "volume": 78.667,
  "weight": null,
  "metadata": {
    "name": "Corsair Graphite Series 730T ATX Full Tower Black Acrylic Side Panel",
    "manufacturer": "Corsair",
    "part_numbers": ["730T Black", "CC-9011046-WW"],
    "series": "Graphite",
    "variant": ""
  },
  "general_product_information": {},
  "identifiers": {
    "version": 1,
    "identifiers": [
      {
        "type": "mpn",
        "value": "730T Black",
        "region": "all"
      },
      {
        "type": "mpn",
        "value": "CC-9011046-WW",
        "region": "all"
      }
    ],
    "retailer_listings": []
  }
}
