{
  "opendb_id": "4b9d1929-6b64-4ddb-b4bb-af010d130e37",
  "metadata": {
    "name": "Cooler Master Elite 342 MicroATX Mini Tower Case w/400 W Power Supply",
    "manufacturer": "Cooler Master",
    "part_numbers": [
      "RC-342-KKRJ-GP"
    ],
    "series": "Elite",
    "variant": ""
  },
  "form_factor": "Micro ATX Mini Tower",
  "color": "Black",
  "power_supply": "400 W",
  "side_panel": "None",
  "has_transparent_side_panel": false,
  "front_panel_usb": "USB 2.0 Type-A",
  "max_video_card_length": 363,
  "max_cpu_cooler_height": null,
  "internal_3_5_bays": 5,
  "internal_2_5_bays": 0,
  "expansion_slots": 4,
  "dimensions": "440 x 180 x 352",
  "volume": 27.878,
  "weight": null,
  "general_product_information": {}
}