{
  "opendb_id": "b1bc5254-dbd1-4909-81b0-dd4519b2ef30",
  "metadata": {
    "name": "Aerocool Dryft Mini V2 MicroATX Mid Tower",
    "manufacturer": "Aerocool",
    "part_numbers": [
      "Dryft-Mini-BK-V2"
    ],
    "series": "Dryft",
    "variant": ""
  },
  "form_factor": "Micro ATX Mid Tower",
  "color": [
    "BLACK"
  ],
  "power_supply": "None",
  "side_panel": "Tempered Glass",
  "has_transparent_side_panel": true,
  "front_panel_usb": "USB 3.2 Gen 1 Type-C                                                    USB 3.2 Gen 1 Type-A",
  "max_video_card_length": 419,
  "max_cpu_cooler_height": null,
  "internal_3_5_bays": 1,
  "internal_2_5_bays": 0,
  "expansion_slots": 7,
  "dimensions": "439 x 290 x 369.5",
  "volume": 47.041,
  "weight": null,
  "general_product_information": {}
}