{
  "opendb_id": "40329769-d260-48b7-8fba-2432b000c6b1",
  "metadata": {
    "name": "Phanteks Enthoo Pro M TG ATX Mid Tower",
    "manufacturer": "Phanteks",
    "part_numbers": [
      "PH-ES515PTG_SWT"
    ],
    "series": "Enthoo",
    "variant": ""
  },
  "form_factor": "ATX Mid Tower",
  "color": "Black / White",
  "power_supply": "None",
  "side_panel": "Tinted Tempered Glass",
  "has_transparent_side_panel": true,
  "front_panel_usb": "USB 3.2 Gen 1 Type-A",
  "max_video_card_length": 420,
  "max_cpu_cooler_height": null,
  "internal_3_5_bays": 2,
  "internal_2_5_bays": 1,
  "expansion_slots": 7,
  "dimensions": "500 x 235 x 480",
  "volume": 56.4,
  "weight": null,
  "general_product_information": {}
}