{
  "opendb_id": "0d8ffba7-ba0a-4c2d-86e5-d6e2d0814766",
  "form_factor": "ATX Mid Tower",
  "supported_motherboard_form_factors": ["ATX", "Micro ATX", "Mini-ITX", "EATX"],
  "color": ["WHITE"],
  "lighting": ["None"],
  "power_supply": "None",
  "power_supply_included": false,
  "supported_power_supply_form_factors": ["ATX"],
  "side_panel": "Tempered Glass",
  "has_transparent_side_panel": true,
  "front_panel_usb": "USB 3.2 Gen 2 Type-C                                                    USB 3.2 Gen 1 Type-A",
  "front_usb_ports": ["2x USB 3.0", "1x USB 3.1 Type C"],
  "max_video_card_length": 362,
  "max_cpu_cooler_height": 170,
  "max_psu_length": 200,
  "internal_3_5_bays": 3,
  "internal_2_5_bays": 6,
  "external_3_5_bays": 0,
  "external_5_25_bays": 0,
  "power_supply_shroud": false,
  "expansion_slots": 7,
  "riser_expansion_slots": 0,
  "supports_rear_connecting_motherboard": false,
  "dimensions": "288 x 384 x 400",
  "dimensions_mm": {
    "depth": 400,
    "width": 288,
    "height": 384
  },
  "volume": 44.24,
  "weight": 18.74,
  "metadata": {
    "name": "Lian Li O11 Air Mini ATX Mid Tower White Tempered Glass",
    "manufacturer": "Lian Li",
    "part_numbers": [],
    "series": "O11 Air Mini",
    "variant": "",
    "releaseYear": 2021,
    "manufacturer_color": "White"
  },
  "general_product_information": {
    "manufacturer_url": "https://lian-li.com/product/o11-air-mini/"
  },
  "identifiers": {
    "version": 1,
    "identifiers": [
      {
        "type": "ean",
        "value": "0840353041578",
        "region": "all"
      },
      {
        "type": "mpn",
        "value": "840353043589",
        "region": "all"
      },
      {
        "type": "mpn",
        "value": "G99.OE785W.IPSG",
        "region": "all"
      },
      {
        "type": "mpn",
        "value": "O11AMW",
        "region": "all"
      },
      {
        "type": "mpn",
        "value": "PC-O11 AMW",
        "region": "all"
      },
      {
        "type": "upc",
        "value": "840353041578",
        "region": "all"
      }
    ],
    "retailer_listings": [
      {
        "source": "amazon",
        "channel": "au",
        "source_product_id": "B09M2T62W2",
        "pricing_enabled": true,
        "verified": true
      },
      {
        "source": "amazon",
        "channel": "be",
        "source_product_id": "B09M2T62W2",
        "pricing_enabled": true,
        "verified": true
      },
      {
        "source": "amazon",
        "channel": "ca",
        "source_product_id": "B09M2T62W2",
        "pricing_enabled": true,
        "verified": true
      },
      {
        "source": "amazon",
        "channel": "de",
        "source_product_id": "B09M2T62W2",
        "pricing_enabled": true,
        "verified": true
      },
      {
        "source": "amazon",
        "channel": "es",
        "source_product_id": "B09M2T62W2",
        "pricing_enabled": true,
        "verified": true
      },
      {
        "source": "amazon",
        "channel": "fr",
        "source_product_id": "B09M2T62W2",
        "pricing_enabled": true,
        "verified": true
      },
      {
        "source": "amazon",
        "channel": "ie",
        "source_product_id": "B09M2T62W2",
        "pricing_enabled": true,
        "verified": true
      },
      {
        "source": "amazon",
        "channel": "it",
        "source_product_id": "B09M2T62W2",
        "pricing_enabled": true,
        "verified": true
      },
      {
        "source": "amazon",
        "channel": "jp",
        "source_product_id": "B09M2T62W2",
        "pricing_enabled": true,
        "verified": true
      },
      {
        "source": "amazon",
        "channel": "nl",
        "source_product_id": "B09M2T62W2",
        "pricing_enabled": true,
        "verified": true
      },
      {
        "source": "amazon",
        "channel": "pl",
        "source_product_id": "B09M2T62W2",
        "pricing_enabled": true,
        "verified": true
      },
      {
        "source": "amazon",
        "channel": "se",
        "source_product_id": "B09M2T62W2",
        "pricing_enabled": true,
        "verified": true
      },
      {
        "source": "amazon",
        "channel": "sg",
        "source_product_id": "B09M2T62W2",
        "pricing_enabled": true,
        "verified": true
      },
      {
        "source": "amazon",
        "channel": "uk",
        "source_product_id": "B09M2T62W2",
        "pricing_enabled": true,
        "verified": true
      },
      {
        "source": "amazon",
        "channel": "us",
        "source_product_id": "B09M2T62W2",
        "pricing_enabled": true,
        "verified": true
      },
      {
        "source": "bhphoto",
        "channel": "us",
        "source_product_id": "LIO11AMW",
        "pricing_enabled": true,
        "verified": false
      },
      {
        "source": "mwave",
        "channel": "au",
        "source_product_id": "AC46895",
        "pricing_enabled": true,
        "verified": false
      },
      {
        "source": "newegg",
        "channel": "ca",
        "source_product_id": "2AM-000Z-00081",
        "pricing_enabled": true,
        "verified": false
      },
      {
        "source": "newegg",
        "channel": "us",
        "source_product_id": "2AM-000Z-00081",
        "pricing_enabled": true,
        "verified": false
      },
      {
        "source": "walmart",
        "channel": "us",
        "source_product_id": "292494862",
        "pricing_enabled": true,
        "verified": false
      }
    ]
  }
}
