{
  "opendb_id": "9043b9da-7b6c-44ba-8193-e75241a808d3",
  "metadata": {
    "name": "MSI MPG GUNGNIR 300R AIRFLOW ATX Mid Tower",
    "manufacturer": "MSI",
    "part_numbers": [
      "GUN300RAIR                                                    306-7G21R21-W57                                                    MPG GUNGNIR 300R AIRFLOW"
    ],
    "series": "MPG",
    "variant": ""
  },
  "form_factor": "ATX Mid Tower",
  "color": [
    "BLACK"
  ],
  "power_supply": "None",
  "side_panel": "Tempered Glass",
  "has_transparent_side_panel": true,
  "front_panel_usb": "USB 3.2 Gen 2x2 Type-C                                                    USB 3.2 Gen 1 Type-A",
  "max_video_card_length": 360,
  "max_cpu_cooler_height": null,
  "internal_3_5_bays": 2,
  "internal_2_5_bays": 6,
  "expansion_slots": 7,
  "dimensions": "505 x 235 x 510",
  "volume": 60.524,
  "weight": null,
  "general_product_information": {
    "newegg_sku": "N82E16811320055",
    "walmart_sku": 5083123157
  }
}